{
  "schema_version": 1,
  "as_of": "2026-10-04",
  "edges": [
    {
      "id": "7-11",
      "from": 7,
      "to": 11,
      "kind": "rewrite",
      "track": "d7-assisted",
      "experimental": true,
      "stages": [
        "d7-inventory",
        "d7-successor-gate",
        "d7-scaffold",
        "d7-fill"
      ],
      "auto_allowed": false
    },
    {
      "id": "8-9",
      "from": 8,
      "to": 9,
      "kind": "rector",
      "set_family": "Drupal8SetList",
      "set_select": "per-minor<=bed",
      "requires_reference_scan": "decided-by-spike",
      "detectors": [
        "simpletest",
        "info-core-8x"
      ],
      "test_conversions": [
        "simpletest-to-browsertestbase"
      ]
    },
    {
      "id": "9-10",
      "from": 9,
      "to": 10,
      "kind": "rector",
      "set_family": "Drupal9SetList",
      "detectors": [
        "twig2-to-3",
        "symfony4-breaks",
        "ckeditor4",
        "jquery-ui",
        "prophecy"
      ],
      "test_conversions": [
        "phpunit-8-9-to-10"
      ]
    },
    {
      "id": "10-11",
      "from": 10,
      "to": 11,
      "kind": "rector",
      "set_family": "Drupal10SetList",
      "detectors": [
        "removed-ext-11",
        "signature-changes"
      ],
      "test_conversions": [
        "phpunit-10-11"
      ]
    },
    {
      "id": "11-12",
      "from": 11,
      "to": 12,
      "kind": "rector",
      "set_family": "Drupal11SetList",
      "breaking_sets": "DRUPAL_11m_BREAKING for m <= F.minor when F.major == 11",
      "always_sets": [
        "Drupal12SetList::DRUPAL_120"
      ],
      "detectors": [
        "removed-ext-12",
        "library-removed",
        "migrate-drupal-usage",
        "symfony8-constraint-validator"
      ],
      "test_conversions": [
        "phpunit-annotations-to-attributes"
      ]
    }
  ],
  "forbidden": [
    {
      "from": 7,
      "to": 12,
      "reason": "D7 lands on 11 then hops (04-F-20, H9)",
      "route": [
        "7-11",
        "11-12"
      ]
    }
  ]
}
